{
  "$id": "https://do-math.invalid/schemas/cli/1/role-response",
  "$schema": "https://json-schema.org/draft/2020-12/schema",
  "additionalProperties": false,
  "properties": {
    "decision": {
      "enum": [
        "match",
        "mismatch",
        "unresolved"
      ],
      "type": "string"
    },
    "findings": {
      "items": {
        "type": "string"
      },
      "type": "array"
    },
    "questions": {
      "items": {
        "type": "string"
      },
      "type": "array"
    },
    "scope_complete": {
      "type": "boolean"
    },
    "summary": {
      "type": "string"
    },
    "used_sources": {
      "items": {
        "type": "string"
      },
      "type": "array"
    }
  },
  "required": [
    "summary",
    "used_sources",
    "questions",
    "decision",
    "findings",
    "scope_complete"
  ],
  "type": "object",
  "x-contract-id": "do-math-cli/1"
}
