{
  "decision": "match",
  "findings": [],
  "questions": [],
  "scope_complete": true,
  "summary": "제안의 형식 명제, 자연어 설명, 요약, 가정 및 Lean 소스가 서로 일치한다. `nat_add_zero`는 모든 자연수 n에 대해 `n + 0 = n`을 주장하며, `Nat.add`의 정의적 환원에 따른 `rfl` 증명으로 이를 정확히 구현한다. 제출된 Lean 검사는 검증되었고 공리에 의존하지 않는다.",
  "used_sources": [
    "KN-01M2F12KGB2MNHDX920773E6KS",
    "EX-01M2F12M9EX12VTNHRTJ4F2WJW",
    "BA-01M2F12PFRZQ4XB4E8N26PPXX3",
    "8d8fab726789471483981564836f3ffc233ada8e"
  ]
}
